{
  "$schema": "./catalog.schema.json",
  "kind": "DepartmentTemplate",
  "catalog_version": "1.0.0",
  "envelope_defaults": {
    "object_type": "DepartmentTemplate",
    "human_readable_summary": "Department-shaped operating model: role mix + shared tools + shared workflows + approval patterns + reporting lines + cadence + compliance risks + cross-functional dependencies. Template metadata only. Compose with CompanyTemplate variants.",
    "model_usage_notes": "Use DepartmentTemplate to seed department-scoped Hive defaults per ADR-0059 and to inform Dandelion department-level question outputs. NEVER use as authorization. Honor RULE 0 sovereignty and ADR-0058 no-manager-surveillance posture.",
    "scope_defaults": ["TENANT_SCOPED", "DEPARTMENT_SCOPED", "ROLE_AGGREGATION_BOUNDARY"],
    "permission_defaults": ["READ_FIRST_AT_DEPARTMENT_AGGREGATE", "NEVER_INDIVIDUAL_SCORING"],
    "provenance": { "authored_by": "NIOV Labs / niov-foundation", "source": "docs/ootb-catalog/departments.json", "version_tag": "wave-2-v1.0.0", "captured_at": "2026-06-01", "authority": "[FOUNDER-ADR-0080-WAVE-2-STATIC-SEED-CATALOG-AUTH] + [FOUNDER-ADR-0080-WAVE-2-ADDENDUM-GOVERNED-CONTEXT-TRANSACTION-ENVELOPE]" },
    "audit_expectations": ["ADMIN_ACTION:DEPARTMENT_TEMPLATE_REFERENCED per ADR-0071 when consumed by Dandelion or Control Tower"],
    "policy_purpose": "CATALOG_REFERENCE_ONLY",
    "allowed_consumers": ["DANDELION_SUGGESTION_ENGINE", "CONTROL_TOWER_ADMIN_REVIEW", "AGENT_TWIN_SCOPED_TO_DEPARTMENT"],
    "forbidden_consumers": ["AGENT_TWIN_CROSS_TENANT", "AGENT_TWIN_INDIVIDUAL_SCORING", "EXTERNAL_THIRD_PARTY_UNAUTHORIZED"],
    "sensitivity_level": "MEDIUM",
    "adaptation_rules": "DepartmentTemplate adapts only through governed signals per ADR-0048; never through private profiling.",
    "override_rules": "Companies may add / disable departments or amend defaults via Control Tower governance review."
  },
  "items": [
    {
      "id": "department.executive-office.v1",
      "version": "1",
      "status": "ACCEPTED",
      "name": "Executive Office",
      "description": "CEO + executive staff + executive support.",
      "governance_notes": "High-sensitivity scope. Board materials and strategic decisions reside here. Templates are defaults, never identity claims.",
      "safe_defaults": ["calendar coordination", "executive briefings", "board logistics"],
      "forbidden_defaults": ["unauthorized board content disclosure", "compensation visibility outside scope"],
      "source_adr_refs": ["ADR-0080"],
      "common_roles": ["role.ceo.v1", "role.coo.v1", "role.executive-assistant.v1"],
      "shared_tools": ["tool.google-calendar.v1", "tool.outlook-calendar.v1", "tool.gmail.v1", "tool.slack.v1", "tool.google-drive.v1"],
      "shared_workflows": ["workflow.tomorrows-executive-brief.v1", "workflow.board-meeting-prep-packet.v1", "workflow.focus-time-protection.v1"],
      "approval_patterns": ["executive sign-off for board materials", "CFO approval for spend exceptions"],
      "reporting_lines": ["CEO → Board Chair", "COO/CFO/CTO → CEO", "EA → executive(s) supported"],
      "operating_cadence": "weekly leadership meetings; monthly business reviews; quarterly board",
      "compliance_risks": ["board confidentiality", "executive correspondence privilege"],
      "cross_functional_dependencies": ["department.finance.v1", "department.legal-compliance.v1"],
      "default_hive_patterns": ["leadership hive (scoped)", "board hive (governance-locked)"],
      "default_metrics": ["strategic OKRs", "executive calendar utilization"],
      "default_documents": ["board agenda", "executive brief", "leadership notes"],
      "default_meetings": ["weekly leadership", "monthly business review", "quarterly board"]
    },
    {
      "id": "department.finance.v1",
      "version": "1",
      "status": "ACCEPTED",
      "name": "Finance",
      "description": "CFO, controller, FP&A, AP/AR, procurement.",
      "governance_notes": "SOX controls authoritative. Spend approval thresholds enforced.",
      "safe_defaults": ["read reports", "review spend exceptions"],
      "forbidden_defaults": ["post journal entries without dual-control", "auto-approve spend above threshold"],
      "source_adr_refs": ["ADR-0080"],
      "common_roles": ["role.cfo.v1"],
      "shared_tools": ["tool.netsuite.v1", "tool.ramp.v1", "tool.brex.v1", "tool.sap-concur.v1"],
      "shared_workflows": ["workflow.spend-approval-review.v1", "workflow.expense-exception-review.v1", "workflow.board-finance-packet-prep.v1", "workflow.vendor-renewal-review.v1"],
      "approval_patterns": ["dual-control for high-value spend", "CFO approval for exceptions"],
      "reporting_lines": ["CFO → CEO", "Controller / FP&A → CFO"],
      "operating_cadence": "monthly close; quarterly forecasting; annual planning",
      "compliance_risks": ["SOX", "tax", "audit"],
      "cross_functional_dependencies": ["department.executive-office.v1", "department.legal-compliance.v1"],
      "default_hive_patterns": ["finance hive"],
      "default_metrics": ["revenue", "burn", "runway", "AR/AP aging"],
      "default_documents": ["financial statements", "board finance packet"],
      "default_meetings": ["monthly close", "weekly finance review"]
    },
    {
      "id": "department.people-hr.v1",
      "version": "1",
      "status": "ACCEPTED",
      "name": "People / HR",
      "description": "CHRO + HRBP + recruiting + people operations.",
      "governance_notes": "Compensation + protected-class data strict; ADR-0058 no manager surveillance.",
      "safe_defaults": ["read aggregate engagement", "manage onboarding logistics"],
      "forbidden_defaults": ["protected-class inference", "employee scoring", "compensation visibility outside scope"],
      "source_adr_refs": ["ADR-0080", "ADR-0058"],
      "common_roles": ["role.chro.v1"],
      "shared_tools": ["tool.workday.v1", "tool.bamboohr.v1", "tool.greenhouse.v1", "tool.lattice.v1"],
      "shared_workflows": ["workflow.hiring-pipeline-risk-review.v1", "workflow.onboarding-checklist.v1", "workflow.offboarding-checklist.v1", "workflow.performance-review-cycle-tracker.v1"],
      "approval_patterns": ["CHRO sign-off for sensitive HR actions", "dual-control for offboarding"],
      "reporting_lines": ["CHRO → CEO"],
      "operating_cadence": "weekly people-ops; quarterly review cycle",
      "compliance_risks": ["employment law", "GDPR HR data", "EEO"],
      "cross_functional_dependencies": ["department.legal-compliance.v1", "department.executive-office.v1"],
      "default_hive_patterns": ["people-ops hive"],
      "default_metrics": ["headcount", "attrition", "engagement"],
      "default_documents": ["org chart", "policies", "review templates"],
      "default_meetings": ["weekly people-ops"]
    },
    {
      "id": "department.legal-compliance.v1",
      "version": "1",
      "status": "ACCEPTED",
      "name": "Legal / Compliance",
      "description": "General Counsel + compliance + privacy + risk.",
      "governance_notes": "Privileged content respected. ADR-0070 neutral compliance vocabulary preserved.",
      "safe_defaults": ["read contracts caller can access", "track compliance evidence"],
      "forbidden_defaults": ["disclose privileged content", "claim regulator approval", "auto-sign contracts"],
      "source_adr_refs": ["ADR-0080", "ADR-0070"],
      "common_roles": ["role.general-counsel.v1", "role.compliance-officer.v1"],
      "shared_tools": ["tool.docusign.v1", "tool.ironclad.v1", "tool.vanta.v1", "tool.drata.v1"],
      "shared_workflows": ["workflow.contract-review-queue.v1", "workflow.audit-evidence-gap-review.v1", "workflow.policy-exception-review.v1"],
      "approval_patterns": ["General Counsel sign-off for contracts", "dual-control for high-risk policy exceptions"],
      "reporting_lines": ["General Counsel → CEO", "Compliance → General Counsel"],
      "operating_cadence": "weekly review queue; quarterly audit prep",
      "compliance_risks": ["contract liability", "regulatory exposure"],
      "cross_functional_dependencies": ["department.executive-office.v1", "department.finance.v1"],
      "default_hive_patterns": ["compliance hive"],
      "default_metrics": ["evidence completeness", "contract throughput"],
      "default_documents": ["contracts", "policies", "audit evidence"],
      "default_meetings": ["weekly legal review"]
    },
    {
      "id": "department.product.v1",
      "version": "1",
      "status": "ACCEPTED",
      "name": "Product",
      "description": "Product management + product operations + design.",
      "governance_notes": "Customer feedback respected. Roadmap decisions transparent.",
      "safe_defaults": ["surface roadmap inputs"],
      "forbidden_defaults": ["overclaim user-research certainty"],
      "source_adr_refs": ["ADR-0080"],
      "common_roles": ["role.product-manager.v1"],
      "shared_tools": ["tool.jira.v1", "tool.linear.v1", "tool.notion.v1", "tool.figma.v1"],
      "shared_workflows": ["workflow.roadmap-decision-brief.v1", "workflow.sprint-risk-summary.v1", "workflow.dependency-risk-review.v1"],
      "approval_patterns": ["product review approval for scope changes"],
      "reporting_lines": ["PM → Head of Product → CEO"],
      "operating_cadence": "weekly product review; sprint cadence; quarterly roadmap",
      "compliance_risks": ["customer-promised features", "privacy by design"],
      "cross_functional_dependencies": ["department.engineering.v1", "department.sales.v1"],
      "default_hive_patterns": ["product hive"],
      "default_metrics": ["roadmap delivery", "feature adoption"],
      "default_documents": ["PRD", "roadmap"],
      "default_meetings": ["sprint planning", "product review"]
    },
    {
      "id": "department.engineering.v1",
      "version": "1",
      "status": "ACCEPTED",
      "name": "Engineering",
      "description": "Engineering managers + software engineers + SRE.",